{"acquisition":[{"commands":["example"],"mode":"system_path","title":"On PATH"}],"actions":[{"args":["--help"],"executable":"main","id":"run","title":"Run it"}],"executables":[{"file":"example{platform.exe_suffix}","name":"main"}],"id":"example.minimal","kind":"tool","license":{"spdx":"MIT"},"name":"Minimal","platforms":[{"platform":{"arch":"amd64","os":"linux"},"status":"supported"}],"publisher":{"name":"Example"},"schema_version":"aucom.profile/1.0","summary":"The smallest tool profile that is valid.","tool_version":"1.0.0","version":"1.0.0"}
