{"acquisition":[{"hint":"choose the folder with qbsp, vis and light in it","mode":"user_path","title":"The copy I already have"}],"actions":[{"args":["-threads","{option.threads}",{"value":"-nopercent","when":{"option":"quiet"}},"{input.source_map}","{output.bsp}"],"capability":"q1.bsp.compile","executable":"qbsp","id":"compile","inputs":[{"extensions":[".map"],"name":"source_map","required":true,"role":"q1.map.source","title":"Map source"}],"options":[{"advanced":true,"default":"false","name":"quiet","title":"Less output","type":"bool"},{"default":"4","maximum":64,"minimum":1,"name":"threads","title":"Threads","type":"integer"},{"default":"level","max_length":64,"name":"basename","title":"Output name","type":"text"}],"outputs":[{"name":"bsp","path":"compile/{option.basename}.bsp","role":"q1.bsp","title":"Compiled BSP"},{"name":"prt","optional":true,"path":"compile/{option.basename}.prt","role":"q1.prt","title":"Portal file"}],"roots":[{"access":"read_write","purpose":"read the staged map source and write the compiled BSP","role":"workspace"}],"timeout_seconds":3600,"title":"Compile the map","working_dir":{"root":"workspace"}}],"capabilities":[{"consumes":["q1.map.source"],"id":"q1.bsp.compile","produces":["q1.bsp","q1.prt"],"title":"Compile a Quake 1 map into a BSP"}],"description":"This document exists to be the other half of a test. It is written the way a person writes JSON — members in a different order, some arguments in the object form and some in the string form, the options listed the other way round — and it describes the same commands as the built-in sample profile. Resolving both produces the same Command, and `Command.Digest` says so.\n\nThat equality is the whole extension model in one assertion. If a built-in profile ever gains a privileged path, this is the test that stops compiling.","executables":[{"file":"qbsp{platform.exe_suffix}","name":"qbsp"}],"game_profile":{"engine_family":"quake1","slug":"quake1"},"id":"example.andrea.q1-compile","kind":"tool","license":{"name":"GNU General Public License v2.0 or later","spdx":"GPL-2.0-or-later"},"name":"Andrea's Q1 compile","platforms":[{"platform":{"arch":"amd64","os":"linux"},"status":"supported"}],"publisher":{"name":"A Companion user"},"schema_version":"aucom.profile/1.0","summary":"A hand-written tool profile that drives the same three programs as the built-in sample.","tool_version":"0.0.0-sample","version":"0.3.0"}
